{
  "schema_version": 1,
  "manifest": {
    "sequence": 16,
    "generated_at": "2026-10-19T14:27:13Z",
    "expires_at": "2027-01-17T14:27:13Z"
  },
  "application": {
    "id": "dev.soliman.aou_hub",
    "name": "AOU Hub",
    "platform": "android",
    "signing_certificate_sha256": "f3bf437811e3c01a227085484af0cb2e723fcd8be54496dfe246d3a1c876b848",
    "direct_upgrade_from_build": 2001,
    "support_url": "https://github.com/ssssoliman937-design/aouapp#readme"
  },
  "security": {
    "manifest_signature_file": "update.json.sig",
    "manifest_key_id": "aouhub-manifest-ed25519-2026"
  },
  "channels": {
    "stable": {
      "minimum_supported": {
        "version": "2.2.1",
        "build": 2025,
        "message": {
          "ar": "النسخة دي بقت قديمة ومبقتش مدعومة. حدّث التطبيق عشان تكمل.",
          "en": "This version is no longer supported. Update to continue."
        }
      },
      "latest": {
        "version": "2.2.1",
        "build": 2025,
        "type": "regular",
        "mandatory": true,
        "mandatory_after": null,
        "withdrawn": false,
        "released_at": "2026-10-19T14:27:13Z",
        "title": {
          "ar": "رفيق AOU 2.2.1 — قفل بالبصمة",
          "en": "AOU Hub 2.2.1 — fingerprint lock"
        },
        "summary": {
          "ar": "قفل التطبيق بالبصمة من الإعدادات، والدخول بالباسورد بيفتح التطبيق على طول من غير ما يطلب البصمة تاني.",
          "en": "Lock the app with your fingerprint from Settings; signing in with your password opens the app without asking for the fingerprint again."
        },
        "highlights": [],
        "release_notes_url": "https://github.com/ssssoliman937-design/aouapp/releases/tag/v2.2.1",
        "requirements": {
          "min_android_sdk": 24
        },
        "packages": [
          {
            "abi": "universal",
            "file_name": "AOU-Hub-2.2.1-2025-universal.apk",
            "url": "https://github.com/ssssoliman937-design/aouapp/releases/download/v2.2.1/AOU-Hub-2.2.1-2025-universal.apk",
            "size_bytes": 69006176,
            "sha256": "e72adaa254d4460f64fb9bc8a1650912d9a82f776828d7d6bc815bb18199b847"
          }
        ]
      }
    }
  }
}
